{
  "id": "access-navigator-prior-auth",
  "model": "product-claim",
  "schemaVersion": "1.0.0",
  "author": "A1B2C3D4E5F6@AdobeID",
  "source": {
    "pipeline": "express-addon",
    "assetId": "urn:aaid:sc:US:7c3e1a90-0000-4000-8000-000000000012",
    "templateId": "product-claim-card-v1"
  },
  "effectiveFrom": "2026-11-01",
  "effectiveTo": null,
  "scope": {
    "indication": "Moderately to severely active rheumatoid arthritis in adults",
    "population": "all-labeled",
    "claimType": "access-support",
    "comparator": "none"
  },
  "content": {
    "headline": "Prior authorization support for your office",
    "lede": "Saltmarsh Access Navigator helps your staff with benefits verification, prior authorization paperwork, and appeals for eligible patients prescribed Tarnexa.",
    "claimText": "Saltmarsh Access Navigator provides benefits verification, prior authorization and appeals support, and a copay program for commercially insured eligible patients. Program terms and eligibility criteria apply.",
    "referenceIds": ["REF-008", "REF-003"],
    "safetyStatementId": "isi-brief",
    "fairBalanceText": "Tarnexa is indicated for adults with moderately to severely active rheumatoid arthritis who have had an inadequate response or intolerance to one or more TNF inhibitors. Boxed warning: serious infections, mortality, malignancy, major adverse cardiovascular events, thrombosis. See full Prescribing Information.",
    "ctaLabel": "Enroll a patient",
    "ctaUrl": "https://hcp.saltmarshtx.example/tarnexa/access-navigator",
    "mslTalkingPoints": [
      "Copay program is commercial-only; government-insured patients are not eligible",
      "Typical PA turnaround is tracked by the program, not promised to the HCP",
      "Step-therapy requirements vary by plan; Navigator submits documentation of prior TNF inhibitor use"
    ]
  },
  "attributes": {
    "evidenceThreshold": 0,
    "unmetNeed": 0,
    "clinicalFit": 0,
    "access": 1,
    "evidenceDepth": 1,
    "interactions": []
  },
  "provenance": {
    "createdAt": "2026-10-10T22:45:00Z",
    "generator": "express-addon@0.1.0",
    "dataStatus": "fictional-demo-data",
    "brandProfileVersion": "2026.10.1",
    "glossaryVersion": "0.1.0"
  }
}
