{
  "id": "acr20-week24-tnf-ir",
  "model": "product-claim",
  "schemaVersion": "1.0.0",
  "author": "A1B2C3D4E5F6@AdobeID",
  "source": {
    "pipeline": "express-addon",
    "assetId": "urn:aaid:sc:US:7c3e1a90-0000-4000-8000-000000000011",
    "templateId": "product-claim-card-v1"
  },
  "effectiveFrom": "2026-11-15",
  "effectiveTo": null,
  "scope": {
    "indication": "Moderately to severely active rheumatoid arthritis in adults",
    "population": "tnf-ir",
    "claimType": "efficacy",
    "comparator": "placebo"
  },
  "content": {
    "headline": "After a TNF inhibitor, a different mechanism",
    "lede": "For your patients with moderately to severely active rheumatoid arthritis who have had an inadequate response to one or more TNF inhibitors, Tarnexa offers a once-daily oral option with a selective JAK1 mechanism.",
    "claimText": "In ESTUARY-1, 61% of patients receiving Tarnexa 15 mg once daily plus background csDMARD achieved ACR20 at week 24 vs 29% with placebo plus csDMARD (p<0.001). ACR50 was achieved by 34% vs 13%.",
    "referenceIds": ["REF-001", "REF-003"],
    "dataPoints": [
      { "label": "ACR20, Tarnexa 15 mg", "value": "61%", "timepoint": "week 24", "referenceId": "REF-001" },
      { "label": "ACR20, placebo", "value": "29%", "timepoint": "week 24", "referenceId": "REF-001" },
      { "label": "ACR50, Tarnexa 15 mg", "value": "34%", "timepoint": "week 24", "referenceId": "REF-001" },
      { "label": "ACR50, placebo", "value": "13%", "timepoint": "week 24", "referenceId": "REF-001" }
    ],
    "safetyStatementId": "isi-boxed-warning",
    "fairBalanceText": "Tarnexa is indicated for adults with moderately to severely active rheumatoid arthritis who have had an inadequate response or intolerance to one or more TNF inhibitors. Boxed warning: serious infections, mortality, malignancy, major adverse cardiovascular events, thrombosis. See full Prescribing Information.",
    "ctaLabel": "See the ESTUARY-1 data",
    "ctaUrl": "https://hcp.saltmarshtx.example/tarnexa/efficacy/estuary-1",
    "mslTalkingPoints": [
      "Primary endpoint ACR20 at week 24; secondary ACR50/70, DAS28-CRP, HAQ-DI",
      "Background csDMARD required in ESTUARY-1; monotherapy data is ESTUARY-2 (REF-002)",
      "Prespecified multi-TNF-IR subgroup is REF-005, do not extrapolate from this fragment",
      "No head-to-head data vs any marketed agent; decline comparative questions"
    ],
    "kolQuote": {
      "text": "The question I get after a first TNF inhibitor fails is whether to cycle or switch mechanism. Data in the TNF-IR population is what lets me answer that for the patient in front of me.",
      "attribution": "Dr. Ines Okafor-Lindqvist, rheumatologist, Portland, ME (fictional)"
    }
  },
  "attributes": {
    "evidenceThreshold": 1,
    "unmetNeed": 1,
    "clinicalFit": 1,
    "access": 0,
    "evidenceDepth": 2,
    "interactions": ["evidenceThreshold*unmetNeed"]
  },
  "provenance": {
    "createdAt": "2026-10-10T22:40:00Z",
    "generator": "express-addon@0.1.0",
    "dataStatus": "fictional-demo-data",
    "brandProfileVersion": "2026.10.1",
    "glossaryVersion": "0.1.0"
  }
}
